{"schema":"https://debz.dev/schema/native-transaction-program-v2","version":2,"backend":"native","install_root":"/srv/root","root_identity_sha256":"1b292ed83668a7231965384ce66f907a5ebd141db7f6f127fe3cad8ef6589b90","target_architecture":"amd64","foreign_architectures":[],"request_sha256":"0000000000000000000000000000000000000000000000000000000000000000","solver_policy_sha256":"1111111111111111111111111111111111111111111111111111111111111111","executor_policy_sha256":"0303030303030303030303030303030303030303030303030303030303030303","plan_sha256":"0404040404040404040404040404040404040404040404040404040404040404","exact_lock":{"schema":"https://debz.dev/schema/exact-closure-lock-v3","version":3,"digest_sha256":"9d3535edadd65511998ac3e2b55707cd65860d4d72445879214eb387645c21eb"},"authorization_sha256":"d10399f4ed78c139668ad19080e2e94dd2a70c4f646f4c1a9b5ac5449be507a2","final_state_sha256":"447c799f80f89b4036fcb734ed188866a7d8dccb881fc22d0bd40a19f217c0ac","policy":{"conffile":"keep_existing","force":[],"allow_host_root":false},"script_policy_sha256":"7025c97cd0a41642097dbdbb11e8cff02a6e6de733b5f7817e8d22a11dcb0593","trigger_authority":null,"installed_database":{"generation_sha256":"7171717171717171717171717171717171717171717171717171717171717171","evidence_sha256":"f26e32a52ecdbb439c673bfc1a5b62570db8d8b149b5b18b53a2d704f26909c8","trigger_state_sha256":"0000000000000000000000000000000000000000000000000000000000000000","package_count":0},"artifacts":[{"index":0,"package":{"name":"seed","version":"1","architecture":"all"},"archive_identity":{"primary":"sha512","digests":[{"algorithm":"sha256","digest":"2222222222222222222222222222222222222222222222222222222222222222"},{"algorithm":"sha512","digest":"33333333333333333333333333333333333333333333333333333333333333333333333333333333333333333333333333333333333333333333333333333333"}]},"size":1,"application_sha256":"4141414141414141414141414141414141414141414141414141414141414141","origin":{"local_artifact":{"artifact_id":{"algorithm":"sha512","digest":"33333333333333333333333333333333333333333333333333333333333333333333333333333333333333333333333333333333333333333333333333333333"},"archive_identity":{"primary":"sha512","digests":[{"algorithm":"sha256","digest":"2222222222222222222222222222222222222222222222222222222222222222"},{"algorithm":"sha512","digest":"33333333333333333333333333333333333333333333333333333333333333333333333333333333333333333333333333333333333333333333333333333333"}]},"size":1,"package":{"name":"seed","version":"1","architecture":"all"},"acquisition_url":"https://example.invalid/seed.deb","trust_mode":"pinned_content_digest"}}}],"artifacts_sha256":"caaae589ca82b557ea944cb981604e10791c02fdb8b8377e6b8853e3a0f9126f","steps":[{"sequence":0,"phase":"preflight","requires":[],"operation":{"assert_authorization":{"authorization_sha256":"d10399f4ed78c139668ad19080e2e94dd2a70c4f646f4c1a9b5ac5449be507a2","plan_sha256":"0404040404040404040404040404040404040404040404040404040404040404","request_sha256":"0000000000000000000000000000000000000000000000000000000000000000","exact_lock_sha256":"9d3535edadd65511998ac3e2b55707cd65860d4d72445879214eb387645c21eb","final_state_sha256":"447c799f80f89b4036fcb734ed188866a7d8dccb881fc22d0bd40a19f217c0ac"}}},{"sequence":1,"phase":"preflight","requires":[0],"operation":{"assert_root_state":{"install_root":"/srv/root","root_identity_sha256":"1b292ed83668a7231965384ce66f907a5ebd141db7f6f127fe3cad8ef6589b90","target_architecture":"amd64","foreign_architectures":[]}}},{"sequence":2,"phase":"preflight","requires":[1],"operation":{"assert_database_generation":{"generation_sha256":"7171717171717171717171717171717171717171717171717171717171717171","evidence_sha256":"f26e32a52ecdbb439c673bfc1a5b62570db8d8b149b5b18b53a2d704f26909c8","package_count":0,"updates_pending":false}}},{"sequence":3,"phase":"preflight","requires":[2],"operation":{"assert_package_absent":{"package":{"name":"seed","architecture":"all"}}}},{"sequence":4,"phase":"preflight","requires":[0],"operation":{"revalidate_artifact":{"artifact":0,"package":{"name":"seed","version":"1","architecture":"all"},"archive_identity":{"primary":"sha512","digests":[{"algorithm":"sha256","digest":"2222222222222222222222222222222222222222222222222222222222222222"},{"algorithm":"sha512","digest":"33333333333333333333333333333333333333333333333333333333333333333333333333333333333333333333333333333333333333333333333333333333"}]},"size":1,"application_sha256":"4141414141414141414141414141414141414141414141414141414141414141"}}},{"sequence":5,"phase":"unpack","requires":[4],"operation":{"unpack_package":{"package":{"name":"seed","version":"1","architecture":"all"},"prior_version":null,"artifact":0,"application_sha256":"4141414141414141414141414141414141414141414141414141414141414141","bootstrapped":false,"prior_owned_paths_sha256":null}}},{"sequence":6,"phase":"unpack","requires":[5],"operation":{"record_package_state":{"package":{"name":"seed","version":"1","architecture":"all"},"state":"unpacked","hold":false,"remove_entry":false}}},{"sequence":7,"phase":"configure","requires":[6],"operation":{"configure_barrier":{"reason":"final","packages":[{"name":"seed","architecture":"all"}]}}},{"sequence":8,"phase":"configure","requires":[7],"operation":{"record_package_state":{"package":{"name":"seed","version":"1","architecture":"all"},"state":"installed","hold":false,"remove_entry":false}}},{"sequence":9,"phase":"verify","requires":[8],"operation":{"publish_database_generation":{"final_state_sha256":"447c799f80f89b4036fcb734ed188866a7d8dccb881fc22d0bd40a19f217c0ac","package_count":1}}},{"sequence":10,"phase":"verify","requires":[9],"operation":{"verify_final_state":{"final_state_sha256":"447c799f80f89b4036fcb734ed188866a7d8dccb881fc22d0bd40a19f217c0ac","installed_count":1,"config_files_count":0,"triggers_pending_count":0,"triggers_awaited_count":0}}},{"sequence":11,"phase":"verify","requires":[10],"operation":{"publish_provenance":{"authorization_sha256":"d10399f4ed78c139668ad19080e2e94dd2a70c4f646f4c1a9b5ac5449be507a2","database_generation_sha256":"7171717171717171717171717171717171717171717171717171717171717171","record_script_outcome_unknown":true}}}],"steps_sha256":"5cdeaf3260c569fa1ae9574bb80508c08e022acce9da88853f76578a2a6d3422","digest_sha256":"85e18358b9e7329377b3f67661d29a5cb805302b512a762956f6040f3e72d7e8"}